{"schema_version":1,"analysis_id":"an_2d7768d29368c85cbdef71fad5833d19","tool_version":"dev","catalog_version":"ai-robots-txt:a0fed45f0eb6723597028b49d5e0990dd4c41920+crawlledger-v1","status":"completed","artifacts":[{"name":"analysis.sqlite","bytes":126976,"sha256":"fc880d4b8402f0e63a35339a230853c1d7f3f28b3a8e457e9244127abf8e6e01"},{"name":"report.html","bytes":5881,"sha256":"0b520c8d61ef10113715b982c15728b50526039e43340d9a223c10a44c760a92"},{"name":"report.json","bytes":4096,"sha256":"f3548cb1841f13bf20b2c991434ff8ccd2d2012cd273614e26fe351164cd7649"}],"privacy":{"raw_lines_retained":false,"hmac_key_retained":false,"anonymous":false,"residual_risks":["stable pseudonyms","timestamps","routes","crawler claims","referer hosts"]}}
